{
  "arguments": [],
  "authorization_state": "not-authorized",
  "configuration_sha256": null,
  "deployed_system_interaction_prohibited": true,
  "errors": [],
  "execution_state": "not-started",
  "exit_status": null,
  "file_statuses": [],
  "repository_id": "pending-phase5b",
  "ruleset_sha256": null,
  "run_id": "pending-phase5b",
  "schema_version": "1.0",
  "source_identity": null,
  "study_id": "phase5-pilot",
  "subject_code_execution_prohibited": true,
  "tool": "mcp-security-scanner",
  "version": null
}
